<?xml version="1.0" encoding="ISO-8859-1"?>
<posts xmlns:xsi="http://www.w3.org/2001/XMLSchema-instance"
       xsi:noNamespaceSchemaLocation="post.xsd">

    <post id="100">
        <header>
            <date>2020-01-01</date>
            <username>Mario Rossi</username>
            <nametag>@mariorossi</nametag>
            <pic>assets/img/user_icon.png</pic>
        </header>
        <main>
            <body>Lorem ipsum odor amet, consectetuer adipiscing elit. Ante sodales ornare integer leo per. Non vestibulum nec aenean primis suspendisse nascetur. Per pharetra natoque ipsum orci sem. Habitasse malesuada imperdiet; semper per augue dolor sollicitudin ipsum varius.</body>
        </main>
        <footer>
            <likes nLikes="10"/>
            <comments nComments="2">
                <comment id="110">
                    <header>
                        <date>2020-01-01</date>
                        <username>Luigi Verdi</username>
                        <nametag>@luigiverdi</nametag>
                        <pic>assets/img/user_icon.png</pic>
                    </header>
                    <main>
                        <body>Well done</body>
                    </main>
                    <footer>
                        <likes nLikes="2"/>
                        <comments nComments="1"/>
                    </footer>
                </comment>

                <comment id="120">
                    <header>
                        <date>2020-01-01</date>
                        <username>Marco Bianchi</username>
                        <nametag>@marcobianchi</nametag>
                        <pic>assets/img/user_icon.png</pic>
                    </header>
                    <main>
                        <body>Javascript is fun!</body>
                    </main>
                    <footer>
                        <likes nLikes="0"/>
                        <comments nComments="0"/>
                    </footer>
                </comment>
            </comments>
        </footer>
    </post>

    <post id="200">
        <header>
            <date>2020-02-02</date>
            <username>Luigi Verdi</username>
            <nametag>@luigiverdi</nametag>
            <pic>assets/img/user_icon.png</pic>
        </header>
        <main>
            <body>I pleased to announce this post have an image with XML!</body>
            <attach>assets/img/a.png</attach>
        </main>
        <footer>
            <likes nLikes="15"/>
            <comments nComments="1">
                <comment id="210">
                    <header>
                        <date>2020-02-02</date>
                        <username>Mario Rossi</username>
                        <nametag>@mariorossi</nametag>
                        <pic>assets/img/user_icon.png</pic>
                    </header>
                    <main>
                        <body>Nice bro I'm proud of you</body>
                    </main>
                    <footer>
                        <likes nLikes="5"/>
                        <comments nComments="2"/>
                    </footer>
                </comment>
            </comments>
        </footer>
    </post>

    <post id="300">
        <header>
            <date>2020-03-03</date>
            <username>Marco Bianchi</username>
            <nametag>@marcobianchi</nametag>
            <pic>assets/img/user_icon.png</pic>
        </header>
        <main>
            <body>This post is only to alternate only text post and post with image. Lorem ipsum odor amet, consectetuer adipiscing elit. Ante sodales ornare integer leo per. Non vestibulum nec aenean primis suspendisse nascetur. Per pharetra natoque ipsum orci sem.</body>
        </main>
        <footer>
            <likes nLikes="3"/>
            <comments nComments="2">
                <comment id="310">
                    <header>
                        <date>2020-03-03</date>
                        <username>Mario Rossi</username>
                        <nametag>@mariorossi</nametag>
                        <pic>assets/img/user_icon.png</pic>
                    </header>
                    <main>
                        <body>So boooring...</body>
                    </main>
                    <footer>
                        <likes nLikes="4"/>
                        <comments nComments="2"/>
                    </footer>
                </comment>

                <comment id="320">
                    <header>
                        <date>2020-03-03</date>
                        <username>Luigi Verdi</username>
                        <nametag>@luigiverdi</nametag>
                        <pic>assets/img/user_icon.png</pic>
                    </header>
                    <main>
                        <body>Please Bro we want more content!</body>
                    </main>
                    <footer>
                        <likes nLikes="10"/>
                        <comments nComments="4"/>
                    </footer>
                </comment>
            </comments>
        </footer>
    </post>

    <post id="400">
        <header>
            <date>2020-04-04</date>
            <username>Argonaut</username>
            <nametag>@argonaut</nametag>
            <pic>assets/img/user_icon.png</pic>
        </header>
        <main>
            <body>Hi everybody I'm new, check it out my first post with image</body>
            <attach>assets/img/b.png</attach>
        </main>
        <footer>
            <likes nLikes="24"/>
            <comments nComments="1">
                <comment id="410">
                    <header>
                        <date>2020-04-04</date>
                        <username>Mario Rossi</username>
                        <nametag>@mariorossi</nametag>
                        <pic>assets/img/user_icon.png</pic>
                    </header>
                    <main>
                        <body>Nice job newest! Take a look also to my new image</body>
                        <attach>assets/img/c.png</attach>
                    </main>
                    <footer>
                        <likes nLikes="17"/>
                        <comments nComments="6"/>
                    </footer>
                </comment>
            </comments>
        </footer>
    </post>
</posts>

