<?xml version="1.0" encoding="ISO-8859-1"?>
<posts xmlns:xsi="http://www.w3.org/2001/XMLSchema-instance"
       xsi:noNamespaceSchemaLocation="post.xsd">

    <post id="500">
        <header>
            <date>2020-05-05</date>
            <username>Argonaut</username>
            <nametag>@argonaut</nametag>
            <pic>assets/img/user_icon.png</pic>
        </header>
        <main>
            <body>This post come from the second file XML</body>
        </main>
        <footer>
            <likes nLikes="34"/>
            <comments nComments="3">
                <comment id="510">
                    <header>
                        <date>2020-05-05</date>
                        <username>Mario Rossi</username>
                        <nametag>@mariorossi</nametag>
                        <pic>assets/img/user_icon.png</pic>
                    </header>
                    <main>
                        <body>This comment too</body>
                    </main>
                    <footer>
                        <likes nLikes="3"/>
                        <comments nComments="2"/>
                    </footer>
                </comment>

                <comment id="520">
                    <header>
                        <date>2020-05-05</date>
                        <username>Luigi Verdi</username>
                        <nametag>@luigiverdi</nametag>
                        <pic>assets/img/user_icon.png</pic>
                    </header>
                    <main>
                        <body>Also me!</body>
                    </main>
                    <footer>
                        <likes nLikes="2"/>
                        <comments nComments="1"/>
                    </footer>
                </comment>

                <comment id="530">
                    <header>
                        <date>2020-05-05</date>
                        <username>Marco Bianchi</username>
                        <nametag>@marcobianchi</nametag>
                        <pic>assets/img/user_icon.png</pic>
                    </header>
                    <main>
                        <body>me too!</body>
                    </main>
                    <footer>
                        <likes nLikes="2"/>
                        <comments nComments="0"/>
                    </footer>
                </comment>
            </comments>
        </footer>
    </post>

    <post id="600">
        <header>
            <date>2020-06-06</date>
            <username>Mario Rossi</username>
            <nametag>@mariorossi</nametag>
            <pic>assets/img/user_icon.png</pic>
        </header>
        <main>
            <body>Very interesting coming from another XML, but check this image</body>
            <attach>assets/img/b.png</attach>
        </main>
        <footer>
            <likes nLikes="11"/>
            <comments nComments="2">
                <comment id="610">
                    <header>
                        <date>2020-06-06</date>
                        <username>Luigi Verdi</username>
                        <nametag>@luigiverdi</nametag>
                        <pic>assets/img/user_icon.png</pic>
                    </header>
                    <main>
                        <body>Nice Bro but this is better</body>
                        <attach>assets/img/a.png</attach>
                    </main>
                    <footer>
                        <likes nLikes="2"/>
                        <comments nComments="1"/>
                    </footer>
                </comment>

                <comment id="620">
                    <header>
                        <date>2020-01-01</date>
                        <username>Marco Bianchi</username>
                        <nametag>@marcobianchi</nametag>
                        <pic>assets/img/user_icon.png</pic>
                    </header>
                    <main>
                        <body>C'mon guys, don't argue</body>
                    </main>
                    <footer>
                        <likes nLikes="0"/>
                        <comments nComments="0"/>
                    </footer>
                </comment>
            </comments>
        </footer>
    </post>

    <post id="700">
        <header>
            <date>2020-07-07</date>
            <username>Marco Bianchi</username>
            <nametag>@marcobianchi</nametag>
            <pic>assets/img/user_icon.png</pic>
        </header>
        <main>
            <body>Last one text only post, because I'm tired to write random text</body>
        </main>
        <footer>
            <likes nLikes="11"/>
            <comments nComments="1">
                <comment id="710">
                    <header>
                        <date>2020-07-07</date>
                        <username>Argonaut</username>
                        <nametag>@argonaut</nametag>
                        <pic>assets/img/user_icon.png</pic>
                    </header>
                    <main>
                        <body>I see bro, so I put one last comment with image</body>
                        <attach>assets/img/c.png</attach>
                    </main>
                    <footer>
                        <likes nLikes="2"/>
                        <comments nComments="1"/>
                    </footer>
                </comment>
            </comments>
        </footer>
    </post>
</posts>

